{
    "bands": {
        "bands": [
            "Cool",
            "Open",
            "Warm",
            "Glow"
        ],
        "clamp": [
            0,
            100
        ],
        "edges": [
            24,
            49,
            74,
            100
        ],
        "rounding": "ROUND_HALF_UP",
        "version": "1"
    },
    "channels": {
        "alias_policy": {
            "aliases": {},
            "mode": "off"
        },
        "centers": [
            "ajna",
            "ego",
            "g",
            "head",
            "root",
            "sacral",
            "solar_plexus",
            "spleen",
            "throat"
        ],
        "domains": [
            "action_voice",
            "bonding_feel",
            "narrative",
            "rhythm",
            "talk"
        ],
        "ids": [
            "01-08",
            "02-14",
            "03-60",
            "04-63",
            "05-15",
            "06-59",
            "07-31",
            "09-52",
            "10-20",
            "10-34",
            "10-57",
            "11-56",
            "12-22",
            "13-33",
            "16-48",
            "17-62",
            "18-58",
            "19-49",
            "20-34",
            "20-57",
            "21-45",
            "23-43",
            "24-61",
            "25-51",
            "26-44",
            "27-50",
            "28-38",
            "29-46",
            "30-41",
            "32-54",
            "34-57",
            "35-36",
            "37-40",
            "39-55",
            "42-53",
            "47-64"
        ]
    },
    "magic10": {
        "caps": {
            "alignment": {
                "bounds": {
                    "max": 100,
                    "min": 0
                },
                "inputs": [
                    "vector_cohesion",
                    "axis_agreement"
                ]
            },
            "balance": {
                "bounds": {
                    "max": 100,
                    "min": 0
                },
                "inputs": [
                    "equilibrium_score",
                    "counterweight_ratio"
                ]
            },
            "comfort": {
                "bounds": {
                    "max": 100,
                    "min": 0
                },
                "inputs": [
                    "soothe_index",
                    "buffer_resilience"
                ]
            },
            "communication": {
                "bounds": {
                    "max": 100,
                    "min": 0
                },
                "inputs": [
                    "signal_clarity",
                    "exchange_density"
                ]
            },
            "consistency": {
                "bounds": {
                    "max": 100,
                    "min": 0
                },
                "inputs": [
                    "pattern_integrity",
                    "variance_stability"
                ]
            },
            "creativity": {
                "bounds": {
                    "max": 100,
                    "min": 0
                },
                "inputs": [
                    "novelty_factor",
                    "expression_flow"
                ]
            },
            "drive": {
                "bounds": {
                    "max": 100,
                    "min": 0
                },
                "inputs": [
                    "willpower_current",
                    "focus_pressure"
                ]
            },
            "expansion": {
                "bounds": {
                    "max": 100,
                    "min": 0
                },
                "inputs": [
                    "growth_tendency",
                    "horizon_reach"
                ]
            },
            "harmony": {
                "bounds": {
                    "max": 100,
                    "min": 0
                },
                "inputs": [
                    "rapport_delta",
                    "resonance_strength"
                ]
            },
            "heat": {
                "bounds": {
                    "max": 100,
                    "min": 0
                },
                "inputs": [
                    "spark_intensity",
                    "momentum_flux"
                ]
            }
        },
        "order": [
            "harmony",
            "heat",
            "communication",
            "alignment",
            "comfort",
            "consistency",
            "expansion",
            "creativity",
            "drive",
            "balance"
        ]
    },
    "schema": "config_bundle.fe.v1",
    "sources": {
        "band_edges": {
            "path": "artifacts/thresholds/band_edges.json",
            "sha256": "7e8931934b147e8a2069e3d2e5c5febada250fb889a1fd6d53405a6dd9986e49",
            "size_bytes": 177
        },
        "magic10_config": {
            "path": "artifacts/thresholds/magic10_config.json",
            "sha256": "222af0fdfc8f87ee2fa2ee326c83bffa0ab9fa840eac7180d294883a7aeec71d",
            "size_bytes": 1425
        },
        "registry_report": {
            "path": "artifacts/registry/registry_report.json",
            "sha256": "e5748db34c5215faeb3b3d91dccdb68255b79efd2df123fca58f3a76057f31d2",
            "size_bytes": 5008
        }
    }
}
